{
  "test_id": "extract_auto_insurance_anyco",
  "runs": 10,
  "built": "2026-10-01T19:45:52Z",
  "config_sha256": "d8a74802ba9f570782c8c0af688bfe0ba87a2d09fa43d350a312a2034f5d3d31",
  "slots": {
    "bodily_injury_premium": {
      "observations": 10,
      "null_rate": 0.0,
      "types": [
        "currency"
      ],
      "json_types": [
        "int"
      ],
      "units": [
        "$"
      ],
      "confidence_signals": [
        "confident_answer"
      ],
      "source_shapes": [
        "999"
      ],
      "number_min": 100,
      "number_max": 100
    },
    "customer_service_phone": {
      "observations": 10,
      "null_rate": 0.0,
      "types": [
        "string"
      ],
      "json_types": [
        "str"
      ],
      "units": [],
      "confidence_signals": [
        "confident_answer"
      ],
      "shapes": [
        "9999 999 9999",
        "9999-999-9999"
      ],
      "length_min": 13,
      "length_max": 13
    }
  }
}
